{"schema_version":1,"source":{"head":"9ef4ffc9adb6ffca17d77719f68d1a8d74a84efd","tree":"61bd27a859096260a3ece61f364868e7eab19e3d","branch":"master","dirty":false,"source_sha256":"0d24939275ffe565ca6cdb1dc52f200e657ef6fa831d63b3b2f66aac580bcd94","file_sha256":{"Cargo.lock":"1194cbc2f6f7b3e89c79fae5ba2853361d576c2529abc45b0361ed5151179ce9","Cargo.toml":"e6ca8b151ac5298d617d450390614742279832f4e888e787b9fbccd2e70e182c","src/actions.rs":"89eb222bfba7ccee2755e4f4ed384a86e1390d2106f281693ffa10158ae38c02","src/capabilities.rs":"8c8bda6d85f45bd40ef01f1d3b2e6191f15bf086bb89b24a7669546fe29ae9d6","src/conformance.rs":"df097bcd89060bba436d9807bda5c2eddeea20828f2fb6ac11138222e7197112","src/core.rs":"3dc51cd83b31eef3fc90d33d81a9fce0ed2376607e0c8b645ba6b8291ffafe8f","src/engine.rs":"cb5bfcec26203eebfc90b5cef083b6b0f88c42faac7a272d25dbf42189d63c55","src/event.rs":"915d8ce20c1cfb655eeec560b16b3822ac357e2c15d924ac885b3ddecd088601","src/input.rs":"63978c621e7056e6ebb43fc7a9636b2791947cc80d86b322bb3eba8bf8123f68","src/interaction.rs":"42b1c5ef03a223ddf739d263610b54e2d78d202495b2892722f7bf64b81f5ac7","src/keymap.rs":"4defb56380d64902b814c917b424b6766f20c3fae05bef145a245ef447c2929b","src/lib.rs":"bf6b30456b0d969df288712b915bd8755480ddb7575c63a90c0ef8b5101c6766","src/presentation.rs":"400e75e10885dc03542e679c452c6855a26d7cac31658e6fa409b8cf17b9794f","src/protocol.rs":"ccbcf88cb6b2ca18422f2964781f73175f28b024f700cfe39db8b2e2136b6377","src/render.rs":"d7d38ca49afcfc9cbecaa4ec48c5abba6a1b422b0b301b9131f9ae8dd82a1f5c","src/substrate.rs":"7e9e9ee8283d288ff88fe07f22c20cb65cc67bed218b4a99c5a5180fd3bdb440","src/system.rs":"dec1fed9b2b443abc4e2f86c99a30a07da5012fec9eeee893558a42036ff494a","src/terminal.rs":"6ad6c78ad590943882a6bdcfee0039d4571c8f03f0dcae0c124b3325cdab3ff5","tools/perf/Cargo.lock":"91e765bff8497df54687a3b7aee0f15d580d751acb43f1624b40ac8c9b6dfdc0","tools/perf/Cargo.toml":"e4b87ab93f458045ce80fe3b08cdbe57f7f379ec11b9d7ca82bdbe588dd23eec","tools/perf/allocation.rs":"3d4562d11a359b358652c56a2c8be918a9d29361f73b536703e7b12422107a19","tools/perf/compare.py":"e1d1b3a443d99de9f770f28ab6ba9d775311befab81c40957f6018389140519d","tools/perf/comparisons/Cargo.lock":"e155f481600f8c8cb629bb512b3eefc9f6ca6261e5768c34748e6ec8cdbbbb64","tools/perf/comparisons/Cargo.toml":"367b2eec59b6d36d8e157d5e9c0bee788efaa5eaee015f5d59eb1e8563617ea1","tools/perf/comparisons/linenoise.c":"e60cd52bda15b9076bf1a9191f9bd4a2f4eb77d4751d623f29f9925df603c032","tools/perf/comparisons/reedline.rs":"bf2c712beef6cf1b4e47154afae8ad2af8ea25a0223d2965d5621a3ff1a1dd43","tools/perf/comparisons/rustyline.rs":"ecb5f196c2122694dbe7c1328d47781a1987475052adb31b2f7e4de5c1ad9bbb","tools/perf/components.rs":"3d05768cc348228a361a8cffc466a1927d1704d6cd45e4d738fcd2b19b51c0bd","tools/perf/embedding.py":"bc386aafe2b207013f6738c1cca19412953f7167a9aea56a9704d5abfe3b866e","tools/perf/linux.py":"11a1a3252c150b0d61923f38c9f3625b93964bbcd35d7bed0bedd34bcf74d9f8","tools/perf/pty_host.rs":"1e7f3d1e946e5a147cbcacf243f69009e8f90f393956dc90e5aa551e3945596d","tools/perf/results.py":"0241b45d800de4a2ee144a6ecbebf0f7101561106002a69289baa8b699d0a0b2","tools/perf/run.py":"bf05591e3297a5464f55cdd1fa45abbb9e4459a5c787732f7e16258dbb9ec0c2","tools/perf/schema.json":"46409d4fbd7dd636e0df6ce0ea80a9608503eb510daac47906fb295999e063d7","tools/perf/sizes.py":"aa8321acebfed19f084d537befb0ce7055b41828a5b55ef943445f7c3c73345e","tools/perf/smoke.py":"bb9dbb2bc7de61bcb6f4d99fc792fcb45fb4eaeb4ea2175898ecef0452186bc5","tools/perf/test_results.py":"248b6da2f5e72b3454b688cb28459da164bd22219e30dc953462522af7ed18fd"}},"environment":{"recorded_utc":"2026-09-07T19:24:19Z","hostname":"6c7a897c401f","os":"Linux-7.0.11-orbstack-00360-gc9bc4d96ac70-aarch64-with-glibc2.36","kernel":"7.0.11-orbstack-00360-gc9bc4d96ac70","architecture":"aarch64","cpu":["CPU implementer\t: 0x61","CPU part\t: 0x000"],"logical_cores":15,"affinity":[0,1],"meminfo":"MemTotal:       12304908 kB\nMemFree:        11375100 kB\nMemAvailable:   11644780 kB\nBuffers:             100 kB\nCached:           207424 kB\nSwapCached:            0 kB\nActive:            72020 kB\nInactive:         263580 kB\nActive(anon):      31768 kB\nInactive(anon):   120416 kB\nActive(file):      40252 kB\nInactive(file):   143164 kB\nUnevictable:           0 kB\nMlocked:               0 kB\nSwapTotal:      13353476 kB\nSwapFree:       13353476 kB\nDirty:                96 kB\nWriteback:             0 kB\nAnonPages:        123436 kB\nMapped:            68424 kB\nShmem:             23812 kB\nKReclaimable:     310864 kB\nSlab:             437808 kB\nSReclaimable:     310864 kB\nSUnreclaim:       126944 kB\nKernelStack:        5856 kB\nPageTables:         3592 kB\nSecPageTables:         0 kB\nNFS_Unstable:          0 kB\nBounce:                0 kB\nWritebackTmp:          0 kB\nCommitLimit:    19505928 kB\nCommitted_AS:     976984 kB\nVmallocTotal:   135288315904 kB\nVmallocUsed:       63796 kB\nVmallocChunk:          0 kB\nPercpu:             3360 kB\nAnonHugePages:         0 kB\nShmemHugePages:        0 kB\nShmemPmdMapped:        0 kB\nFileHugePages:         0 kB\nFilePmdMapped:         0 kB\nBalloon:               0 kB","governors":{"/sys/devices/system/cpu/cpu11/cpufreq/scaling_governor":"performance","/sys/devices/system/cpu/cpu9/cpufreq/scaling_governor":"performance","/sys/devices/system/cpu/cpu7/cpufreq/scaling_governor":"performance","/sys/devices/system/cpu/cpu5/cpufreq/scaling_governor":"performance","/sys/devices/system/cpu/cpu3/cpufreq/scaling_governor":"performance","/sys/devices/system/cpu/cpu14/cpufreq/scaling_governor":"performance","/sys/devices/system/cpu/cpu1/cpufreq/scaling_governor":"performance","/sys/devices/system/cpu/cpu12/cpufreq/scaling_governor":"performance","/sys/devices/system/cpu/cpu10/cpufreq/scaling_governor":"performance","/sys/devices/system/cpu/cpu8/cpufreq/scaling_governor":"performance","/sys/devices/system/cpu/cpu6/cpufreq/scaling_governor":"performance","/sys/devices/system/cpu/cpu4/cpufreq/scaling_governor":"performance","/sys/devices/system/cpu/cpu2/cpufreq/scaling_governor":"performance","/sys/devices/system/cpu/cpu13/cpufreq/scaling_governor":"performance","/sys/devices/system/cpu/cpu0/cpufreq/scaling_governor":"performance"},"loadavg":[0.080078125,0.11181640625,0.3466796875],"rust":"rustc 1.96.1 (31fca3adb 2026-06-26)\nbinary: rustc\ncommit-hash: 31fca3adb283cc9dfd56b49cdee9a96eb9c96ffd\ncommit-date: 2026-06-26\nhost: aarch64-unknown-linux-gnu\nrelease: 1.96.1\nLLVM version: 22.1.2","cargo":"cargo 1.96.1 (356927216 2026-06-26)","c_compiler":"cc (Debian 12.2.0-14+deb12u1) 12.2.0\nCopyright (C) 2022 Free Software Foundation, Inc.\nThis is free software; see the source for copying conditions.  There is NO\nwarranty; not even for MERCHANTABILITY or FITNESS FOR A PARTICULAR PURPOSE.","python":"3.11.2 (main, May 12 2026, 05:17:27) [GCC 12.2.0]","clock":{"implementation":"clock_gettime(CLOCK_MONOTONIC)","resolution_seconds":1e-09},"strace":"strace -- version 6.1\nCopyright (c) 1991-2022 The strace developers <https://strace.io>.\nThis is free software; see the source for copying conditions.  There is NO\nwarranty; not even for MERCHANTABILITY or FITNESS FOR A PARTICULAR PURPOSE.\n\nOptional features enabled: no-m32-mpers","valgrind":"valgrind-3.19.0","build_environment":{"RUSTFLAGS":null,"CARGO_ENCODED_RUSTFLAGS":null,"CARGO_BUILD_TARGET":null,"CARGO_PROFILE_RELEASE_OPT_LEVEL":null},"build_profile":"release opt-level=3 debug=1 panic=unwind, no LTO or CPU-native override","host_description":"Apple M5 Pro MacBook Pro, 15 cores, 24 GiB; macOS 26.6.2 (25G83), Darwin 25.6.0; OrbStack Docker 29.4.0 Linux aarch64 VM; container replai-p0 pinned vCPUs 0,1, memory.max 6 GiB; host frequency/governor uncontrolled","memory_cgroup_max":"6442450944","cpu_cgroup_max":"max 100000","terminal":"Linux openpty 80x24, controlling TTY, xterm-256color, NO_COLOR; no terminal emulator","dependencies":"replai v0.1.0-dev.0 (/work)\n\u251c\u2500\u2500 rustix v1.1.4\n\u2502   \u251c\u2500\u2500 bitflags v2.13.1\n\u2502   \u2514\u2500\u2500 linux-raw-sys v0.12.1\n\u251c\u2500\u2500 unicode-segmentation v1.13.3\n\u2514\u2500\u2500 unicode-width v0.2.2","os_packages":"gcc\t4:12.2.0-3\nlibc6:arm64\t2.36-9+deb12u14\nnodejs\t18.20.4+dfsg-1~deb12u2\npython3\t3.11.2-1+b1\nstrace\t6.1-0.1\nvalgrind\t1:3.19.0-1"},"methodology":{"outlier_policy":"retain all valid samples; no trimming","percentiles":"nearest rank; median averages middle pair","warmup":"2 per microbenchmark group and 2 PTY/comparison invocations; output/idle report no warmup","clocks":"monotonic; microseconds are serialization units, not a precision guarantee","allocation":"separate feature build; System allocation/reallocation requests and logical live bytes; allocator metadata/RSS/internal realloc overlap unobserved","micro_timing":"setup, validation and returned-value drop excluded; drops inside operation included; control/timer floor recorded","pty":"includes scheduler/IPC and kernel PTY delivery; does not measure emulator repaint or physical display","authority":"recorded development VM; descriptive baseline, not a regression-grade isolated bare-metal lab"},"results":[{"schema_version":1,"id":"idle/0","component":"idle","operation":"poll","status":"measured","mode":"idle","iterations":3,"observations":[{"elapsed_seconds":1.000000068,"poll_calls":3928822,"timeout_ms":0,"cpu_seconds_lifecycle":1.0014729999999998,"window_seconds":1.002009568000176,"resident_kib_at_ready":1892},{"elapsed_seconds":1.00000011,"poll_calls":3943082,"timeout_ms":0,"cpu_seconds_lifecycle":1.0006680000000001,"window_seconds":1.0020597760003511,"resident_kib_at_ready":1900},{"elapsed_seconds":1.000000152,"poll_calls":3912143,"timeout_ms":0,"cpu_seconds_lifecycle":1.0006300000000001,"window_seconds":1.0020758600003319,"resident_kib_at_ready":1896}],"scope":"production poll calls and lifecycle-inclusive child rusage; zero timeout is deliberate busy polling"},{"schema_version":1,"id":"idle/1","component":"idle","operation":"poll","status":"measu